{
  "$schema": "https://json-schema.org/draft/2020-12/schema",
  "title": "Odin agent definition",
  "type": "object",
  "required": ["id", "purpose", "reads", "writes", "skills", "rules"],
  "properties": {
    "id": {"type": "string", "pattern": "^[a-z0-9][a-z0-9-]*$"},
    "purpose": {"type": "string", "minLength": 1},
    "reads": {"type": "array", "items": {"type": "string"}},
    "writes": {"type": "array", "items": {"type": "string"}},
    "skills": {"type": "array", "items": {"type": "string"}, "uniqueItems": true},
    "rules": {"type": "array", "items": {"type": "string"}, "maxItems": 8}
  },
  "additionalProperties": false
}
